{
  "play": "60-responsible-ai-dashboard",
  "version": "1.0.0",
  "context": {
    "knowledge": [
      "T2-Responsible-AI",
      "T3-Production-Patterns",
      "F1-GenAI-Foundations",
      "T1-Fine-Tuning-MLOps"
    ],
    "waf": [
      "responsible-ai",
      "security",
      "operational-excellence",
      "reliability"
    ],
    "scope": "responsible-ai-dashboard-solution"
  },
  "primitives": {
    "agents": [
      "./.github/agents/builder.agent.md",
      "./.github/agents/reviewer.agent.md",
      "./.github/agents/tuner.agent.md"
    ],
    "instructions": [
      "./.github/instructions/responsible-ai-dashboard-patterns.instructions.md"
    ],
    "skills": [
      "./.github/skills/deploy-responsible-ai-dashboard/",
      "./.github/skills/evaluate-responsible-ai-dashboard/",
      "./.github/skills/tune-responsible-ai-dashboard/"
    ],
    "hooks": [
      "../../hooks/frootai-secrets-scanner/",
      "../../hooks/frootai-tool-guardian/",
      "../../hooks/frootai-governance-audit/"
    ],
    "guardrails": {
      "groundedness": 0.85,
      "coherence": 0.8,
      "relevance": 0.8,
      "safety": 0,
      "costPerQuery": 0.05
    }
  },
  "infrastructure": {
    "bicep": "./infra/main.bicep",
    "parameters": "./infra/parameters.json"
  },
  "toolkit": {
    "devkit": ".github/",
    "tunekit": "config/",
    "speckit": "spec/"
  }
}
