{
  "play": "63-fraud-detection-agent",
  "version": "1.0.0",
  "context": {
    "knowledge": [
      "R3-Deterministic-AI",
      "O2-Agent-Coding",
      "T3-Production-Patterns",
      "F1-GenAI-Foundations"
    ],
    "waf": [
      "security",
      "reliability",
      "performance-efficiency",
      "cost-optimization",
      "operational-excellence"
    ],
    "scope": "fraud-detection-agent-solution"
  },
  "primitives": {
    "agents": [
      "./.github/agents/builder.agent.md",
      "./.github/agents/reviewer.agent.md",
      "./.github/agents/tuner.agent.md"
    ],
    "instructions": [
      "./.github/instructions/fraud-detection-agent-patterns.instructions.md"
    ],
    "skills": [
      "./.github/skills/deploy-fraud-detection-agent/",
      "./.github/skills/evaluate-fraud-detection-agent/",
      "./.github/skills/tune-fraud-detection-agent/"
    ],
    "hooks": [
      "../../hooks/frootai-secrets-scanner/",
      "../../hooks/frootai-tool-guardian/",
      "../../hooks/frootai-governance-audit/"
    ],
    "guardrails": {
      "groundedness": 0.85,
      "coherence": 0.8,
      "relevance": 0.8,
      "safety": 0,
      "costPerQuery": 0.05
    }
  },
  "infrastructure": {
    "bicep": "./infra/main.bicep",
    "parameters": "./infra/parameters.json"
  },
  "toolkit": {
    "devkit": ".github/",
    "tunekit": "config/",
    "speckit": "spec/"
  }
}
