{
  "play": "02-ai-landing-zone",
  "version": "1.0.0",
  "context": {
    "knowledge": [
      "O5-GPU-Infra",
      "T3-Production-Patterns"
    ],
    "waf": [
      "security",
      "reliability",
      "cost-optimization",
      "operational-excellence"
    ],
    "scope": "ai-landing-zone-solution"
  },
  "primitives": {
    "agents": [
      "./.github/agents/builder.agent.md",
      "./.github/agents/reviewer.agent.md",
      "./.github/agents/tuner.agent.md"
    ],
    "instructions": [
      "./.github/instructions/ai-landing-zone-patterns.instructions.md",
      "./.github/instructions/azure-coding.instructions.md",
      "./.github/instructions/security.instructions.md"
    ],
    "skills": [
      "./.github/skills/deploy-azure/",
      "./.github/skills/evaluate/",
      "./.github/skills/tune/"
    ],
    "hooks": [
      "../../hooks/frootai-secrets-scanner/",
      "../../hooks/frootai-tool-guardian/",
      "../../hooks/frootai-governance-audit/"
    ],
    "guardrails": {
      "groundedness": 0.85,
      "coherence": 0.8,
      "relevance": 0.8,
      "safety": 0,
      "costPerQuery": 0.05
    }
  },
  "infrastructure": {
    "bicep": "./infra/main.bicep",
    "parameters": "./infra/parameters.json"
  },
  "toolkit": {
    "devkit": ".github/",
    "tunekit": "config/",
    "speckit": "spec/"
  }
}
