{
  "play": "48-ai-model-governance",
  "version": "1.0.0",
  "context": {
    "knowledge": [
      "T3-Production-Patterns",
      "T2-Responsible-AI",
      "T1-Fine-Tuning-MLOps",
      "O5-GPU-Infra"
    ],
    "waf": [
      "operational-excellence",
      "security",
      "responsible-ai",
      "reliability",
      "cost-optimization"
    ],
    "scope": "ai-model-governance-solution"
  },
  "primitives": {
    "agents": [
      "./.github/agents/builder.agent.md",
      "./.github/agents/reviewer.agent.md",
      "./.github/agents/tuner.agent.md"
    ],
    "instructions": [
      "./.github/instructions/ai-model-governance-patterns.instructions.md"
    ],
    "skills": [
      "./.github/skills/deploy-ai-model-governance/",
      "./.github/skills/evaluate-ai-model-governance/",
      "./.github/skills/tune-ai-model-governance/"
    ],
    "hooks": [
      "../../hooks/frootai-secrets-scanner/",
      "../../hooks/frootai-tool-guardian/",
      "../../hooks/frootai-governance-audit/"
    ],
    "guardrails": {
      "groundedness": 0.85,
      "coherence": 0.8,
      "relevance": 0.8,
      "safety": 0,
      "costPerQuery": 0.05
    }
  },
  "infrastructure": {
    "bicep": "./infra/main.bicep",
    "parameters": "./infra/parameters.json"
  },
  "toolkit": {
    "devkit": ".github/",
    "tunekit": "config/",
    "speckit": "spec/"
  }
}
