{
  "play": "34-edge-ai-deployment",
  "version": "1.0.0",
  "context": {
    "knowledge": [
      "F2-LLM-Selection",
      "T1-Fine-Tuning-MLOps",
      "T3-Production-Patterns"
    ],
    "waf": [
      "security",
      "reliability",
      "cost-optimization",
      "performance-efficiency"
    ],
    "scope": "edge-ai-deployment-solution"
  },
  "primitives": {
    "agents": [
      "./.github/agents/builder.agent.md",
      "./.github/agents/reviewer.agent.md",
      "./.github/agents/tuner.agent.md"
    ],
    "instructions": [
      "./.github/instructions/edge-ai-deployment-patterns.instructions.md"
    ],
    "skills": [
      "./.github/skills/deploy-edge-ai-deployment/",
      "./.github/skills/evaluate-edge-ai-deployment/",
      "./.github/skills/tune-edge-ai-deployment/"
    ],
    "hooks": [
      "../../hooks/frootai-secrets-scanner/",
      "../../hooks/frootai-tool-guardian/",
      "../../hooks/frootai-governance-audit/"
    ],
    "guardrails": {
      "groundedness": 0.85,
      "coherence": 0.8,
      "relevance": 0.8,
      "safety": 0,
      "costPerQuery": 0.05
    }
  },
  "infrastructure": {
    "bicep": "./infra/main.bicep",
    "parameters": "./infra/parameters.json"
  },
  "toolkit": {
    "devkit": ".github/",
    "tunekit": "config/",
    "speckit": "spec/"
  }
}
