{
  "play": "51-autonomous-coding-agent",
  "version": "1.0.0",
  "context": {
    "knowledge": [
      "O2-Agent-Coding",
      "F4-GitHub-Agentic-OS",
      "T3-Production-Patterns",
      "O3-MCP-Tools-Functions"
    ],
    "waf": [
      "security",
      "reliability",
      "operational-excellence",
      "cost-optimization"
    ],
    "scope": "autonomous-coding-agent-solution"
  },
  "primitives": {
    "agents": [
      "./.github/agents/builder.agent.md",
      "./.github/agents/reviewer.agent.md",
      "./.github/agents/tuner.agent.md"
    ],
    "instructions": [
      "./.github/instructions/autonomous-coding-agent-patterns.instructions.md"
    ],
    "skills": [
      "./.github/skills/deploy-autonomous-coding-agent/",
      "./.github/skills/evaluate-autonomous-coding-agent/",
      "./.github/skills/tune-autonomous-coding-agent/"
    ],
    "hooks": [
      "../../hooks/frootai-secrets-scanner/",
      "../../hooks/frootai-tool-guardian/",
      "../../hooks/frootai-governance-audit/"
    ],
    "guardrails": {
      "groundedness": 0.85,
      "coherence": 0.8,
      "relevance": 0.8,
      "safety": 0,
      "costPerQuery": 0.05
    }
  },
  "infrastructure": {
    "bicep": "./infra/main.bicep",
    "parameters": "./infra/parameters.json"
  },
  "toolkit": {
    "devkit": ".github/",
    "tunekit": "config/",
    "speckit": "spec/"
  }
}
