{
  "play": "47-synthetic-data-factory",
  "version": "1.0.0",
  "context": {
    "knowledge": [
      "F1-GenAI-Foundations",
      "F2-LLM-Selection",
      "T1-Fine-Tuning-MLOps",
      "T2-Responsible-AI",
      "T3-Production-Patterns"
    ],
    "waf": [
      "security",
      "responsible-ai",
      "cost-optimization",
      "operational-excellence"
    ],
    "scope": "synthetic-data-factory-solution"
  },
  "primitives": {
    "agents": [
      "./.github/agents/builder.agent.md",
      "./.github/agents/reviewer.agent.md",
      "./.github/agents/tuner.agent.md"
    ],
    "instructions": [
      "./.github/instructions/synthetic-data-factory-patterns.instructions.md"
    ],
    "skills": [
      "./.github/skills/deploy-synthetic-data-factory/",
      "./.github/skills/evaluate-synthetic-data-factory/",
      "./.github/skills/tune-synthetic-data-factory/"
    ],
    "hooks": [
      "../../hooks/frootai-secrets-scanner/",
      "../../hooks/frootai-tool-guardian/",
      "../../hooks/frootai-governance-audit/"
    ],
    "guardrails": {
      "groundedness": 0.85,
      "coherence": 0.8,
      "relevance": 0.8,
      "safety": 0,
      "costPerQuery": 0.05
    }
  },
  "infrastructure": {
    "bicep": "./infra/main.bicep",
    "parameters": "./infra/parameters.json"
  },
  "toolkit": {
    "devkit": ".github/",
    "tunekit": "config/",
    "speckit": "spec/"
  }
}
