{
  "play": "22-multi-agent-swarm",
  "version": "1.0.0",
  "context": {
    "knowledge": ["O2-AI-Agents", "O1-Semantic-Kernel", "O3-MCP-Tools-Functions", "T3-Production-Patterns"],
    "waf": ["security", "reliability", "cost-optimization", "performance-efficiency", "operational-excellence"],
    "scope": "multi-agent-swarm-orchestration"
  },
  "primitives": {
    "agents": [
      "./.github/agents/swarm-supervisor.agent.md",
      "./.github/agents/swarm-researcher.agent.md",
      "./.github/agents/swarm-analyst.agent.md"
    ],
    "instructions": ["../../instructions/python-waf.instructions.md"],
    "skills": [],
    "hooks": [
      "../../hooks/frootai-secrets-scanner/",
      "../../hooks/frootai-tool-guardian/",
      "../../hooks/frootai-governance-audit/"
    ],
    "guardrails": {
      "groundedness": 0.90,
      "coherence": 0.92,
      "relevance": 0.88,
      "safety": 0,
      "costPerQuery": 0.05
    }
  },
  "infrastructure": {
    "bicep": "./infra/main.bicep",
    "parameters": "./infra/parameters.json"
  },
  "toolkit": {
    "devkit": "./.github/",
    "tunekit": "./config/",
    "speckit": "./spec/"
  }
}
